"","Datum","Titel","Artikel"
"22",2007-12-20,"Exchange Server 2007 Unified Messaging - Drei auf einen Schlag   ","Exchange Server 2007 Unified Messaging - Drei auf einen Schlag   von Klaus Jotz   2543 words12 November 2007Windows 2000 MagazinWINMG052German© 2007 Konradin Verlag. All Rights Reserved. For further information see   http://www.win2000mag.de[http://www.win2000mag.de]Die Zusammenführung der einzelnen Kommunikationsnetze in einem Unternehmen kann sich vorteilhaft auf den administrativen Aufwand auswirken. Mit dem neuen Unified Messaging Server als Teil des Exchange Servers 2007 bietet  Microsoft die Möglichkeit zum Umstieg. Allerdings sind dabei einige technische Voraussetzungen zu beachten.   Der schnelle Zugriff auf die relevanten Informationen ist eine wesentliche Grundlage für den Unternehmenserfolg. Das gilt heute mehr denn je, da die Nachrichtenflut immer größere Ausmaße annimmt. Zudem wollen viele Mitarbeiter auch von unterwegs Einsicht in die für sie bestimmten Nachrichten. Voraussetzung für die problemfreie und schnelle Bereitstellung der Daten ist der Einsatz intelligenter Kommunikationslösungen, die E-Mails, Telefonanrufe, Faxe, Anrufbeantworter oder selbst SMS selbstständig verwalten und anwenderorientiert präsentieren. Darüber hinaus müssen solche Systeme sowohl für den Benutzer als auch den Administrator möglichst einfach in der Bedienung und Betreuung sein.   Die aktuellen Systeme lösen diese Aufgaben bereits mit hoher Qualität, allerdings meist getrennt voneinander. So werden gesprochene und geschriebene Nachrichten häufig über separate Systeme abgewickelt. E-Mails erreichen das Unternehmen über spezielle Nachrichtenserver wie Exchange, und die Anwender greifen auf sie mit dedizierten Mail-Clients wie Outlook zu. Sprachnachrichten sind davon völlig losgelöst. Sie laufen über gesonderte Nebenstellenanlagen und Telefonapparate. Ähnlich ist es bei Faxen, die meist an unabhängigen Geräten ankommen und nicht, wie erforderlich, direkt bei ihrem Adressaten. S   tattdessen verteilen andere Mitarbeiter die Ausdrucke, wenn sie nicht ohnehin liegen bleiben oder übersehen werden. Darin liegt ein besonderer Nachteil dieser Technik, der zumindest einen gefährlichen Zeitverlust bedeutet. Aber auch die vielen unterschiedlichen Tools, Oberflächen und Funktionen, mit denen die Anwender und Administratoren umgehen müssen, machen die Handhabung solcher Nachrichteninfrastrukturen nicht gerade einfacher und fördern nur die Ineffizienz.   Vereinheitlichung der Nachrichteninfrastruktur. Ein Weg, diese Strukturen zu optimieren, heißt Unified Messaging (UM). Eine solche Lösung bündelt alle Arten von Nachrichten auf einer einzigen Plattform und stellt sie von dort aus zur Verfügung. Die Systeme bieten den Anwendern die Möglichkeit, alle Informationen schnell zu überblicken und an jedem beliebigen Ort bedarfsorientiert und je nach Verfügbarkeit und Zugriffsrecht zu bearbeiten. Durch die Konsolidierung der wichtigen Nachrichtensysteme auf einer Plattform reduziert sich für den Administrator die Anzahl der zu verwaltenden Systeme und für den Benutzer die Vielzahl von Endgeräten. Das verringert den Schulungsaufwand bei der Ausbildung und vereinfacht die Sicherheitsstrukturen. Selbst die Sicherung und Wiederherstellung der Daten ist nur noch für ein Gerät erforderlich.   Speziell die Anwender ziehen Nutzen aus der Vereinheitlichung. Da alle Nachrichten auf nur einem Eingangspostfach eintreffen, haben sie zu jeder Zeit die vollständige Kontrolle darüber. Auch der Zugriff erfolgt in der Regel über ein einheitliches Endgerät. Die Einbindung von Sprachfunktionen ermöglicht zudem die Übertragung der Nachrichten beispielsweise auf mobile Telefone. So können die Benutzer bereits auf dem Weg zu ihrem Arbeitsplatz ihre E-Mails und Sprachaufzeichnungen abhören oder sich Faxe auf das Mobiltelefon weiterleiten lassen.   Allerdings konnten sich UM-Systeme bislang noch nicht in dem Maße durchsetzen, wie es aufgrund ihrer Vorteile zu erwarten wäre. Eine mögliche Ursache könnten die Anschaffungs- und Einbindungskosten sein, für die die Anwender noch keine schnelle Amortisierung sehen. Speziell die Anbindung an eine bestehende PBX ist nicht immer einfach, da es im Markt eine Vielzahl unterschiedlicher Telefonanlagen gibt, die mit häufig stark voneinander abweichenden Prozessen aufwarten. Eine UM-Lösung, die mit einem Großteil der PBXs zusammenarbeitet, lässt sich nur schwer finden und hat natürlich einen entsprechend höheren Anschaffungspreis. Außerdem wurden in der Vergangenheit die Telefon- und E-Mail-Systeme ebenfalls von unterschiedlichen Firmen entwickelt und geliefert. Auch entstanden voneinander abweichende Protokolle und Prozesse, was zu einer zusätzlichen Komplexität beim Integrationsprozess führte.   Das große Potenzial hinter UM, aber zugleich die damit verbundene Notwendigkeit einer Konsolidierung der Nachrichtensysteme, erkannte auch  Microsoft. Deshalb integrierte das Softwareunternehmen mit Unified Messaging eine neue Serverfunktion in den Exchange Server 2007. Mit seiner 2003er-Linie konzentrierte sich der Hersteller noch auf Benutzeranforderungen wie E-Mail, Terminplanung, Webkonferenzen, Anwesenheits- und Verfügbarkeitsanzeige sowie Instant Messaging für Unternehmen. Der neue Nachrichtenserver baut nun auf diesen Merkmalen auf und soll die Anwender zusätzlich bei der Einhaltung rechtlicher Vorgaben unterstützen. Der Kern der Erweiterungen bezieht sich jedoch auf die Kommunikationsmethodik, die Planung und Durchführung von Meetings sowie die Anbindung von Soft- und IP-Telefonen. Durch die Einführung neuer Audio-, Video- und Webkonferenzfunktionen will  Microsoft die Effizienz dieser Prozess steigern.   Alles auf ein Postfach. Einer der wesentlichen Vorteile des neuen Nachrichtenservers besteht in der Konsolidierung der verteilten Voice-Mail-Systeme. Mit herkömmlichen Anlagen erfordert jeder Standort sein eigenes Voicemail-System, das in den jeweiligen Nebenstellenanlagen vor Ort integriert ist – ein hoher administrativer Aufwand. Wie bereits die Postfächer in Exchange 2003, so zentralisiert nun Exchange 2007 UM das Voicemail-System in einem Server. Das soll auch dann funktionieren, wenn weiterhin jeder Standort mit seiner eigenen PBX arbeitet. Dazu nutzt die UM-Funktion von Exchange das Active Directory (AD).   Neben dem Postfachserver, dem Clientzugriffsserver, dem Hub-Transport-Server und dem Edge-Transport-Server ist UM eine weitere eigenständige Serverrolle. Diese Serverfunktion arbeitet als Server auf mittlerer Stufe, der die Verbindung zwischen einer PBX-(Private Branch Exchange; private Telefonvermittlungsstelle) und dem Exchange-2007-Server herstellt. Zusätzlich zu den bereits bekannten E-Mail-Funktionen bietet der Nachrichtenserver nun den Faxempfang über T.38, einen ins Postfach integrierten Anrufbeantworter und Sprachzugriff auf die Postfächer. Der Schwerpunkt liegt dabei auf dem möglichst allumfassenden Zugriff auf Nachrichten (Bild 1). Die UM-Funktion in Exchange 2007 ist jedoch kein Ersatz für einen Faxserver (das Versenden von Faxen ist in dieser Version noch nicht vorgesehen, hierzu ist weiterhin die Nutzung eines zusätzlichen Tools erforderlich) oder eine IP-Telefonanlage. Die Software selbst enthält keinen Verzeichnisserver, der VoIP-Teilnehmer miteinander verbindet. Sie verfügt auch nicht über Gateways, die den Übergang ins normale Telefonnetz ermöglichen. Diese Dienste stellt beispielsweise der Office Communication Server bereit, der auch Telefoniefunktionen ermöglicht. Allerdings spricht Exchange 2007 UM VoIP over TCP und lässt sich damit als Endstelle an eine bestehende VoIP-Anlage anschließen. Für die Nutzung der UM-Funktion des Nachrichtenservers muss also im Unternehmen zumindest eine rudimentäre VoIP-Infrastruktur existieren.   Der Administrator kann Exchange 2007 UM entweder an eine traditionelle PBX oder an eine IP-PBX anschließen. Die Verbindung des UM-Servers mit einer IP-PBX (zum Beispiel  Siemens, Nortel,  Avaya, Mitel oder NEC) funktioniert direkt, da beide über das SIP (Session Initiation Protocol) miteinander kommunizieren. Lediglich eine zusätzliche Standard-NIC-Karte im UM-Server ist erforderlich.   Vielfach setzen die Unternehmen aber noch auf herkömmliche Telefonanlagen. Die Anbindung an den UM-Server nimmt der Administrator über ein zusätzliches VoIP- und FoIP (Fax over IP)-Gateway vor, das leitungsvermittelnde Protokolle wie TDM (Time Division Multiplexing) in paketvermittelnde Protokolle wie SIP (und zurück) übersetzt. Diese Gateways unterstützen die meisten der herkömmlichen Telefonanlagen und sind heute relativ preisgünstig.  Microsoft hat bereits einige der Produkte ( Intel, Dialolgic,  AudioCodes) auf Kompatibilität getestet. (Eine Liste kompatibler IP-/VoIP-Gateways ist auf der Webseite   http://technet.microsoft.com/de-de/library/bb123948.aspx  [http://technet.microsoft.com/de-de/library/bb123948.aspx] zu finden. Die PBXs stehen auf   http://technet.microsoft.com/de-de/library/aa996831.aspx  [http://technet.microsoft.com/de-de/library/aa996831.aspx]). Jedes VoIP-Gateway wird später in AD als UM-IP-Gateway abgebildet. W   ährend diese Geräte an den Standorten der jeweiligen PBXs installiert sind, befindet sich der UM-Server in nächster Nähe zur Hauptinfrastruktur von Exchange. Er kommuniziert mit den anderen Exchange-Server-Rollen und speichert die Nachrichten zentral auf dem Postfachserver. Da der UM-Server mit beiden Arten von PBXs kommunizieren kann, ist aus Sicht von  Microsoft kein Umstieg auf VoIP-Systeme erforderlich. Diese Entscheidung sollte ein Unternehmen allein aus strategischen Überlegungen heraus treffen und wenn der Umstieg aus geschäftlichen Gründen sinnvoll ist.   AD übernimmt die Kontrolle. Die Konsolidierung von E-Mail und UM-Funktionen in Exchange 2007 bietet dem Administrator einen Vorteil hinsichtlich der Verwaltung seiner Benutzer. Er muss sich nur noch um eine einzige Verzeichnisinfrastruktur kümmern. AD verwaltet nun nicht nur die E-Mail-Konten sondern auch die Postfächer für Sprach- und Faxnachrichten. Deshalb kommt den Active-Directory-Objekten eine besondere Bedeutung zu, da sie nicht mehr nur den E-Mail-Betrieb sondern auch die Zuordnung von Sprach- und Faxinformationen steuern. Dabei verbinden die Active Directory-UM-Objekte die Telefoninfrastruktur mit der AD-Umgebung von Exchange Server 2007 UM und ermöglichen damit erst die Integration dieser beiden autarken Systeme. AD arbeitet in diesem Zusammenhang als Container für alle erstellten UM-Objekte, inklusive deren Konfiguration. Der Exchange Server 2007 benötigt jedes einzelne UM-Objekt, um Unified Messaging in einer AD-Umgebung zu unterstützen. Die UM-AD-Objekte haben unterschiedliche Aufgaben (Bild 2): Einige von ihnen dienen der logischen Darstellung von Telefongeräten, andere bilden den Telefonwählplan einer Organisation ab oder unterstützen bestimmte UM-Funktionen des Exchange 2007 Servers. Zwischen den UM-AD-Objekten und den Funktionen des UM-Servers bestehen daher integrierte und vernetzte Beziehungen, die der Administrator wie beim Aufbau jeder anderen AD-Struktur vorab genau analysieren und definieren muss. Nur dann wird die Bereitstellung einer UM-Infrastruktur auf Basis von Exchange 2007 erfolgreich sein.   Darauf müssen Administratoren achten. Die Administratoren haben bei der Migration oder Neueinführung des Exchange Server 2007 einige wichtige Aspekte zu beachten. Der Exchange Server 2007 Unified Messaging-Server muss Mitglied einer Domäne sein, bevor die Serverfunktion UnifiedMessaging für ein neues UM-Computerobjekt installiert wird. Diese UM-Computerobjekte stellen die Verbindung zwischen der Telefoninfrastruktur und der Exchange Server 2007 UM-AD-Netzwerkumgebung her und sind gleichzeitig eine logische Abbildung des physikalischen Servers, auf dem die UM-Serverfunktion installiert ist. Der Installationsvorgang richtet die UM-Computerobjekte automatisch in AD ein. Nach der Installation der UM-Serverfunktion befindet sich der UM-Server standardmäßig im aktivierten Status. Diesen Zustand kann der Administrator in der Exchange-Verwaltungskonsole mit den beiden Befehlen „Enable-UMServer“ und „Disable UMServer“ steuern.   Damit der UM-Server überhaupt seine Arbeit aufnehmen kann, muss der Administrator mindestens einen so genannten Wählplan erstellen, mit dem sowohl der UM-Server als auch das IP-Gateway verknüpft sind. Er bildet die zentrale Komponente des UM-Systems, ist in AD integriert und gilt für die gesamte Exchange 2007-Organisation. Der UM-Wählplan ist ein AD-Containerobjekt, das die Gruppierungen der Nebenstellenanlagen logisch abbildet und damit auch die von ihnen gemeinsam genutzten Durchwahlnummern der Benutzer (Telefonwählplan). Diese Information ist für den UM-Server von elementarer Bedeutung, da er nur über diesen Wählplan die auf den PBX-Anlagen gehosteten Nebenanschlüsse der Benutzer richtig zuordnen kann. Geht ein Anruf auf einem IP/VoIP-Gateway ein, wird dieser Anruf an den UM-Server weitergeleitet. Dieser versucht anhand des dazugehörigen UM-Wählplans die Durchwahlnummer des Benutzers zu ermitteln und verarbeitet den Anruf anschließend anhand der vom Benutzer oder Administrator getroffenen Einstellungen weiter.   Zusammen mit dem Wählplan erstellt das System eine UM-Postfachrichtlinie. Sie wird intern als <DialPlanName>-Standardrichtlinie bezeichnet. Gibt der Administrator nach dem Erstellen des ersten UM-IP-Gateways keinen UM-Wählplan an, richtet das System zusätzlich einen UM-Standardsammelanschluss in AD ein.   Die Wählplanverknüpfung passt sich den Gegebenheiten der jeweiligen Organisation an. Der Administrator kann einen UM-Server mit einem oder mehreren Wählplänen verknüpfen oder auch mehrere UM-Server mit nur einem oder mehreren Wählplänen. Nach dem Start des UM-Servers sucht dieser alle IP/VoIP-Gateways, die den UM-Wählplänen und dem UM-Server zugeordnet sind. Damit er auch mögliche Änderungen an der Konfiguration von UM-Wählplänen oder UM-IP-Gateways erkennen und bestimmen kann, überprüft er alle 10 Minuten die Konfiguration oder registriert die Änderungsbenachrichtigungen.   Steuerung per Sprache. Da der Exchange Server 2007 UM unter anderem eine Sprachsteuerung verwendet, ist die Installation der richtigen Sprachversion eine wesentliche Grundvoraussetzung für die problemlose Funktion. Dafür stellt  Microsoft so genannte UM-Sprachpakete zur Verfügung. Jedes dieser Sprachpakete umfasst ein TTS (Text-to-Speech)-Modul sowie vorab aufgezeichnete Ansagen in der betreffenden Sprache. Die UM-Sprachpakete gibt es in 16 Sprachen, die alle auf der Exchange 2007-DVD enthalten sind.   Allerdings unterstützt derzeit nur das englische Sprachpaket die automatische Spracherkennung (Automatic Speech Recognition, ASR). Für andere Sprachpakete ist ASR in der Planung. In mehrsprachigen Umgebungen muss der Administrator eventuell zusätzliche UM-Sprachpakete installieren und dem jeweiligen Benutzer zuordnen. Darüber hinaus ist dies auch für die Wiedergabe fremdsprachiger Informationen erforderlich, da sonst der Text anderssprachiger Nachrichten nicht korrekt per TTS wiedergeben wird. Die TTS-Funktionen stellt der  Microsoft Speech Server Dienst bereit. Seine Informationen holt er aus den Betreffangaben, dem Namen und dem Nachrichtentext von E-Mail- und Voice-Mail-Nachrichten. Zusätzlich zu diesen Daten entnimmt er den Kalenderelementen noch die Ortsangaben, die Namen der persönlichen Kontakte und die Voice-Mail-Standardbegrüßung eines Benutzers. Das TTS-Modul liest den geschriebenen Text und konvertiert ihn direkt in eine für den Anrufer hörbare Ausgabe.   Jeder neu erstellte UM-Wählplan enthält seine eigene Standardspracheinstellung, mit der die TTS-Umwandlung oder eine standardmäßige Audioansage für Outlook Voice Access-Benutzer wiedergegeben wird. Der Administrator muss nicht zwingend eine Standardsprache für den Wählplan einstellen, da das System die Standardsprache jedes neuen Wählplans aufgrund der installierten Sprachversion von Exchange 2007 konfiguriert. Das gilt auch für lokalisierte Exchange-Versionen.   Die richtige Einstellung der Standardsprache ist auch für den Anrufer wichtig. Wählt sich ein OVA-Benutzer in das UM-System ein, verwendet das System jene Sprache, die in Outlook Web Access (OWA) konfiguriert ist. Diese wurde zu dem Zeitpunkt festgelegt, als sich der Benutzer erstmals mithilfe von OWA an seinem Postfach anmeldete. Der UM-Server vergleicht die in OWA festgelegte Sprache mit der Liste der im Wählplan verfügbaren Sprachen. Findet er keine passende Entsprechung, verwendet er die Standardsprache des UM-Wählplans. Manchmal muss der Administrator diese als Standardsprache festlegen. Enthält der Wählplan beispielsweise ausschließlich deutschsprachige Benutzer, kann der Administrator dessen Standardspracheinstellung in Deutsch ändern.   Mithilfe von Exchange 2007 UM können die Benutzer in der Exchange 2007-Organisation ihre gesamten E-Mail-, Sprach- und Faxnachrichten in einem einzigen Postfach empfangen, was die Produktivität enorm steigert. Der Administrator erstellt dazu für einen Benutzer entweder ein neues Postfach oder stellt eine Verbindung zu einem bereits vorhandenen Postfach her und aktiviert dieses für UM. Das System übermittelt die für diesen Benutzer eintreffenden E-Mail-, Sprach- und Faxnachrichten aufgrund des Wählplans nur noch an diesen Posteingang des Benutzers (Bild 3). Dem Anwender selbst bieten sich nun mehrere Schnittstellen für den Zugriff auf sein Postfach: Outlook 2007, Outlook Web Access, ein für Exchange ActiveSync aktiviertes mobiles Gerät, ein Festnetz- oder ein Mobiltelefon.   Die Anwender greifen mithilfe ihrer für den UM-Wählplan konfigurierten Teilnehmerzugriffsnummer auf den UM-Server zu. Hier unterscheidet das System zwei Arten von Anwendern: authentifizierte und nicht authentifizierte Anrufer (Bild 4). Wählt ein Anwender seine für einen Wählplan konfigurierte Teilnehmerzugriffsnummer, stuft ihn Exchange UM zunächst als anonym und nicht autorisiert ein. Erst wenn er weitere Informationen wie zum Beispiel seine Voice-Mail-Durchwahl und die zugehörige PIN eingibt wird er als autorisiert anerkannt. Nicht autorisierte Benutzer dürfen lediglich die Verzeichnissuchfunktion nutzen. Nur die autorisierten Anwender erhalten Zugriff auf ihr Postfach und die Funktion Outlook Voice Access (OVA). Diese UM-Funktion besteht aus einer Reihe von Sprachansagen, über die der autorisierte Anrufer auf seine E-Mail-, Voice-Mail- oder Faxnachrichten sowie auf seinen Outlook-Kalender und andere Informationen zugreift. Die jeweiligen Anwenderoperationen wie die Navigation durch die persönlichen Informationen, das Einleiten von Anrufen oder das Suchen anderer Benutzer ermöglicht das System entweder über die MFV-Tasten des Telefons oder über gesprochene Befehle.   Somit bietet dieses Zusammenspiel der einzelnen Funktionen von E-Mail-, Sprach- und Faxsystemen nicht nur dem Administrator deutliche Vorteile, sondern stellt auch für den Endanwender eine wesentliche Erleichterung bei der Bewältigung der täglichen Nachrichtenflut dar. •   Konradin Verlag Robert Kohlhammer GmbHDocument WINMG00020071112e3bc00005"
"23",2018-01-20," Artificial Intelligence Market to Rise at Spectacular CAGR of 36.10% During 2016-2024, Players in End-use Industries Leverage its Potential...wallstreet:online, 12:30, 16 August 2018, 1027 words, (German)(Document WC67106020180816ee8g002eg)"," Artificial Intelligence Market to Rise at Spectacular CAGR of 36.10% During 2016-2024, Players in End-use Industries Leverage its Potential..."
"24",2018-01-20," Spitch Befragung zeigt hohen Bedarf an Sprachtechnologien bei Schweizer BankenMoneycab.com, 17:03, 16 August 2018, 476 words, (German)(Document WC56730020180816ee8g001xi)"," Spitch Befragung zeigt hohen Bedarf an Sprachtechnologien bei Schweizer Banken"
"25",2018-08-13,"KI-Konferenz für Software Developer","KI-Konferenz für Software Developer238 words13 August 2018Elektronikpraxis OnlineELEKTWGermanCopyright 2018. Vogel Communications Group GmbH & Co. KG Unter dem Motto „People – Code – AI“ hält WeAreDevelopers eine Konferenz zu Künstlicher Intelligenz in Wien ab. Namhafte Entwickler und IT-Experten berichten dort über aktuelle Trends in den Bereichen Machine Learning und Artificial Intelligence.Mit dem WeAreDevelopers AI Congress hat die Entwickler-Plattform ein weiteres Event speziell für App- und Anwendungsentwickler ins Leben gerufen. Rund 2.000 Developer und IT-Experten sollen sich am Dienstag und Mittwoch, 4. und 5. Dezember 2018, im Kongress- und Veranstaltungszentrum Hofburg einfinden.Kernthemen der Konferenz sind Machine Learning und Künstliche Intelligenz sowie die jüngsten Errungenschaften und Entwicklungen hinsichtlich der Interaktion zwischen Mensch und Maschine. Ein besonderer Fokus liegt dabei auf der Vertrauensbildung gegenüber maschinellen Entscheidungen sowie der Verbesserung der Nutzererfahrung mit maschineller Lernsoftware, unterstreicht Benjamin Ruschin, Managing Director und Co-Founder von WeAreDevelopers.Die zweitägige Konferenz umfasst 32 Experten-Vorträge und Panels sowie 16 Workshops, die explizit auf die Interessen von Entwicklern zugeschnitten sind. „Machine Learning basiert auf den Säulen Vision, Sound & Speech Recognition, Natural Language Processing (NLP) sowie Data Science und Analytics“, sagt Ruschin mit Blick auf die Konferenzplanung. „Alle vier Bereiche werden ausführlich in diversen Experten-Vorträgen und Diskussionsrunden aufgegriffen.“Neben den Entwicklern erwartet WeAreDevelopers auch die Teilnahme von über 300 IT-Experten auf Management-Ebene. Alle Teilnehmer können sich auf dem AI-Kongress fachspezifisch miteinander austauschen und vernetzen.Dieser Beitrag stammt von unserem .Der WeAreDevelopers AI Congress steht unter dem Motto „People – Code – AI“.Vogel Communications Group GmbH & Co.KGDocument ELEKTW0020180813ee8d00004"
"26",2018-03-20," Voice Biometric Solutions Market to be Worth US$ 13,049.2 Mn by 2026: Transparency Market Researchwallstreet:online, 12:30, 3 August 2018, 913 words, (German)(Document WC67106020180803ee83002pp)"," Voice Biometric Solutions Market to be Worth US$ 13,049.2 Mn by 2026: Transparency Market Research"
