"","Datum","Titel","Artikel"
"63",2018-05-14,"ZSmart ermöglicht intelligente Transformation auf dem TM Forum DTW 2018","ZSmart ermöglicht intelligente Transformation auf dem TM Forum DTW 2018475 words14 May 2018news aktuell OTS - OriginaltextserviceOTSGerman(c) 2018 news aktuell Nizza, Frankreich (ots/PRNewswire) - ZTEsoft freut sich, seine Teilnahme am TM Forum Digital Transformation World (DTW) 2018 (ehemaliges TM Forum Live!) bekanntzugeben, das vom 14. bis 16. Mai 2018 in Nizza, Frankreich, stattfindet. Auf dem diesjährigen DTW 2018 wird ZTEsoft seine neueste auf künstliche Intelligenz (Artifical Intelligence, AI) gestützte Telecom Brain-Lösung sowie die ZSmart QConnect- und Internet-der-Dinge- (Internet of Things-, IoT-)Lösung vorstellen, um branchenübergreifende Transformationsprozesse voranzubringen.Telecom Brain fördert ein verbessertes Erlebnis und operative EffizienzDie Telecom Brain-Lösung ist eine maßgeschneiderte Lösung für CSPs, mit der Geschäftstätigkeiten im Bereich Telekommunikation intelligent, effizient und erfahrungsorientiert gestaltet werden können. Telecom Brain ist auf mehrere verschiedene Geschäftsszenarien ausgerichtet, und zwar durch:- digitale Plattform ""ZSmart"", die CSPs durch branchenübergreifende Integration unterstützt, Kommunikationsprozesse zwischen verschiedenen Parteien zu verwalten, flexible Marketing-Strategien zu integrieren und Kunden breitgefächerte digitale Lebenserfahrungen zu bieten. - ZSmart Knowledge-Defined Operations (KDOps), ein AI-optimiertes operationsunterstützendes System mit einem auf maschinellem Lernen basierten Gehirn, das informierte und auf Massendaten gestützte Analysen vornehmen und Entscheidungen fällen kann. ZSmart KDOps ermöglicht CSPs, Arbeitsvorgänge und Verwaltungsprozesse mit schneller Failover-Strategie und automatisierter Entscheidungsfindung zu modernisieren. - AI-basiertes ZSmart uTalk, das Kundendienstmitarbeitern über Omnikanal-Verfahren und einem Wechsel von reaktiver Hilfestellung zu proaktivem Support einen breiteren Handlungsspielraum einräumt. Die Technologie für automatisierte Spracherkennung (Automatic Speech Recognition, ASR) bietet Mensch-Maschine-koordiniertes Arbeiten über einen rund um die Uhr zugänglichen Online-Roboter, der einfache, wiederkehrende Probleme handhaben kann und auf intelligente Weise Kundenanfragen erkennt.ZSmart QConnect modernisiert Ihr Netzwerk und Ihre Dienste im IKT-ZeitalterDas Modernisieren von Netzwerken und Entwickeln innovativer Dienstleistungen mit Cloud Computing, was in der heutigen Software-orientieren Landschaft zum Überleben notwendig ist, bereitet CSPs oftmals Schwierigkeiten. ZSmart QConnect bietet einen One-Stop-Marktplatz für Cloud- und Netzwerkdienste mit einer flexiblen Orchestrierung physischer und virtueller Netzwerke, wodurch CSPs von der Synergie von Cloud und Netzwerk profitieren können, um so ein Ökosystem für intelligente Cloud-Netzwerk-Dienste aufzubauen.Unbegrenzte Wertschöpfung im IoT-ÖkosystemZTEsoft bietet Kunden branchenübergreifend End-to-End-IoT-Lösungen, die von Verbindungsmanagement und Partnermanagement bis zu Anwendungsentwicklung und Platform Enablement reichen. Die ZSmart IoT-Lösung stärkt die Zuverlässigkeit der IoT-Infrastruktur, sodass ein effektives Verwalten Ihrer IoT-Geschäfte vom Sensor bis zur Cloud möglich ist. ZTEsoft möchte mit einem Fokus auf der Infrastruktur und dem Partnerökosystem die Konvergenz von Mensch, Dingen und Cloud in einer digitalen Welt realisieren, um so letztlich mit Partnern ein offenes und umfassendes IoT-Ökosystem zu schaffen.Besuchen Sie uns auf dem TM Forum DTW 2018 an Stand Nr. 332 (3. Etage) im Acropolis Convention Center, um mehr über ZSmart-Lösungen zu erfahren.OTS: ZTEsoft newsroom: http://www.presseportal.de/nr/130646[http://www.presseportal.de/nr/130646] newsroom via RSS: http://www.presseportal.de/rss/pm_130646.rss2[http://www.presseportal.de/rss/pm_130646.rss2]Pressekontakt: Cher Dong +86-177-1432-5727 dong.xu51@ztesoft.com3943039news aktuell GmbHDocument OTS0000020180514ee5e003uy"
"64",2018-05-14,"ZSmart ermöglicht intelligente Transformation auf dem TM Forum DTW 2018","ZSmart ermöglicht intelligente Transformation auf dem TM Forum DTW 2018475 words14 May 201813:48Austria Presse Agentur-OTSAUPAGGermanOTS - ""ORIGINAL TEXT-SERVICE UNTER VERANTWORTUNG DES AUSSENDERS"" Nizza, Frankreich - ZTEsoft freut sich, seine Teilnahme am TM Forum Digital Transformation World (DTW) 2018 (ehemaliges TM Forum Live!) bekanntzugeben, das vom 14. bis 16. Mai 2018 in Nizza, Frankreich, stattfindet. Auf dem diesjährigen DTW 2018 wird ZTEsoft seine neueste auf künstliche Intelligenz (Artifical Intelligence, AI) gestützte Telecom Brain-Lösung sowie die ZSmart QConnect- und Internet-der-Dinge- (Internet of Things-, IoT-)Lösung vorstellen, um branchenübergreifende Transformationsprozesse voranzubringen.Telecom Brain fördert ein verbessertes Erlebnis und operative EffizienzDie Telecom Brain-Lösung ist eine maßgeschneiderte Lösung für CSPs, mit der Geschäftstätigkeiten im Bereich Telekommunikation intelligent, effizient und erfahrungsorientiert gestaltet werden können. Telecom Brain ist auf mehrere verschiedene Geschäftsszenarien ausgerichtet, und zwar durch:- digitale Plattform ""ZSmart"", die CSPs durch branchenübergreifende   Integration unterstützt, Kommunikationsprozesse zwischen   verschiedenen Parteien zu verwalten, flexible Marketing-Strategien   zu integrieren und Kunden breitgefächerte digitale   Lebenserfahrungen zu bieten. - ZSmart Knowledge-Defined Operations (KDOps), ein AI-optimiertes    operationsunterstützendes System mit einem auf maschinellem Lernen   basierten Gehirn, das informierte und auf Massendaten gestützte   Analysen vornehmen und Entscheidungen fällen kann. ZSmart KDOps   ermöglicht CSPs, Arbeitsvorgänge und Verwaltungsprozesse mit   schneller Failover-Strategie und automatisierter   Entscheidungsfindung zu modernisieren. - AI-basiertes ZSmart uTalk, das Kundendienstmitarbeitern über   Omnikanal-Verfahren und einem Wechsel von reaktiver Hilfestellung   zu proaktivem Support einen breiteren Handlungsspielraum einräumt.   Die Technologie für automatisierte Spracherkennung (Automatic   Speech Recognition, ASR) bietet Mensch-Maschine-koordiniertes   Arbeiten über einen rund um die Uhr zugänglichen Online-Roboter,   der einfache, wiederkehrende Probleme handhaben kann und auf   intelligente Weise Kundenanfragen erkennt.ZSmart QConnect modernisiert Ihr Netzwerk und Ihre Dienste im IKT-ZeitalterDas Modernisieren von Netzwerken und Entwickeln innovativer Dienstleistungen mit Cloud Computing, was in der heutigen Software-orientieren Landschaft zum Überleben notwendig ist, bereitet CSPs oftmals Schwierigkeiten. ZSmart QConnect bietet einen One-Stop-Marktplatz für Cloud- und Netzwerkdienste mit einer flexiblen Orchestrierung physischer und virtueller Netzwerke, wodurch CSPs von der Synergie von Cloud und Netzwerk profitieren können, um so ein Ökosystem für intelligente Cloud-Netzwerk-Dienste aufzubauen.Unbegrenzte Wertschöpfung im IoT-ÖkosystemZTEsoft bietet Kunden branchenübergreifend End-to-End-IoT-Lösungen, die von Verbindungsmanagement und Partnermanagement bis zu Anwendungsentwicklung und Platform Enablement reichen. Die ZSmart IoT-Lösung stärkt die Zuverlässigkeit der IoT-Infrastruktur, sodass ein effektives Verwalten Ihrer IoT-Geschäfte vom Sensor bis zur Cloud möglich ist. ZTEsoft möchte mit einem Fokus auf der Infrastruktur und dem Partnerökosystem die Konvergenz von Mensch, Dingen und Cloud in einer digitalen Welt realisieren, um so letztlich mit Partnern ein offenes und umfassendes IoT-Ökosystem zu schaffen.Besuchen Sie uns auf dem TM Forum DTW 2018 an Stand Nr. 332 (3. Etage) im Acropolis Convention Center, um mehr über ZSmart-Lösungen zu erfahren.Rückfragehinweis:   Cher Dong   +86-177-1432-5727   dong.xu51@ztesoft.comDigitale Pressemappe: http://www.ots.at/pressemappe/PR130646/aom[http://www.ots.at/pressemappe/PR130646/aom]*** OTS-ORIGINALTEXT PRESSEAUSSENDUNG UNTER AUSSCHLIESSLICHER INHALTLICHER VERANTWORTUNG DES AUSSENDERS - WWW.OTS.AT ***OTS0129-20180514APA - Austria Presse Agentur eGDocument AUPAG00020180514ee5e006el"
"65",2003-05-20,"PC liest Lippen.","PC liest Lippen.34 words5 May 2003FocusFOCUS129German© 2003 FOCUS – DAS MODERNE NACHRICHTENMAGAZIN, FOCUS MAGAZIN VERLAG GMBH, www.focus.deComputernewsMit Hilfe eines neuen Programmpakets von Intel sollen Computer Sprachebesser verstehen: Die ""Audio Visual Speech Recognition""-Software erfasstGesicht und Lippenbewegungen des Sprechers und kann so Umgebungsgeräuscheleichter ausfiltern.Focus Magazin Verlag GmbHDocument focus00020030506dz55000bk"
"66",2014-11-20,"Technology Leadership Market in Prague","Technology Leadership Market in Prague773 words11 November 2014NewsKitchen.euNKITDEGermanCopyright 2014.  Multimedia Investments Ltd.  All rights reserved.   MIL OSI[http://milnz.co.nz/mil-osi-aggregation/] - Source: Telekom Stiftung - Press Release/StatementHeadline: Technology Leadership Market in PragueNov 11, 2014At the Technology Leadership Market in Prague, Deutsche Telekom showed how its local operations are making it the leading European telco. Together, they leverage the Group’s technology leadership to provide customers across its footprint with truly the best experience.What is next for partners and customers? What can they expect from DT and its technology in the next few years? These were just two of the questions that employees and journalists from across Europe tackled at the first Technology Leadership Market.*A device purchased directly from Deutsche Telekom performs better and faster in the DT network than one purchased via third-party sales channels. That’s why the Terminal Shared Service Center tests devices for the DT Group.*T-Mobile is the first operator in the Czech Republic to introduce LTE, enabling speeds of up to 225 Mbps in the downlink and 50 Mbps in the uplink. They are also working on voice over LTE, which they demonstrated using Samsung devices.*Millions of attacks are launched against the network every month. The company’s local operations work closely with the DT Group and each other to secure the network and their customers’ data.*Innovation has many forms, also in customer service. Video call centers, voice biometrics and speech recognition are all being tested by Deutsche Telekom and its national companies.*DT works with partner companies to deliver the applications and services customers want. The award-winning T-Parking app, for instance, was developed by an internal startup at T-Mobile Czech Republic and uses Big Data resources to provide up to the minute updates on the parking situation on streets.*In all, almost 30 journalists from five countries got a first-hand look at how the DT Group works with its national companies to achieve technology leadership and provide the best customer experience.T-Mobile Czech Republic, which hosted the event, is home to the Terminal Shared Service Center. This competence center optimizes fixed-line and mobile devices for DT customers in its 13 national companies. The devices are put through rigorous testing either in Prague or in three other locations across Germany. Once the tests are completed, DT gives the requirements to the manufacturers to ensure they are ideally integrated into the DT network. “An optimized device is much faster on our network,” explained Daniel Michálek, International Head of Terminal Integration & Validation, in Prague. When a voice call which is made via 3G ends, it takes far less time to switch back to high-speed LTE data connection. “This is a difference the customer feels right away,” continued Michálek. The competence center is also responsible for testing apps and software developed by Deutsche Telekom and its partner companies. One factor they focus on is, of course, security.Sharing the knowledge to provide data securityWith the number of hacking attempts increasing every month, Regional Chief Technology Security Officer Ivo Pastucha, sees DT in the role of a defender: “T-Mobile Czech Republic can hardly fight all these hackers, but it can protect data and customers.” The Head of the Group's Data Reliance Shared Service Center knows: “There is and always will be a gap between system protection and the implementation of new components.” One percent of DSL data traffic in the Czech Republic is malicious, but most of the customers do not know anything about this constant, imminent threat. There is a lack of transparency which has to be overcome in the next years, Pastucha explained.See and hear the future of customer serviceTechnology can also help to improve Customer service at Deutsche Telekom. Magyar Telekom, the company’s subsidiary in Hungary, is running a pilot project whereby customer service agents can help customers via video conference. What is more, they can use a type of heads-up-display to drag and drop products and tariff descriptions, for instance, right onto the screen. This enables customers to actually see what they are signing up for. The company is also developing better voice biometrics solutions that let customers identify themselves by just saying a passphrase. A speech recognition solution will also allow customers to say what they want and a so-called virtual assistant brings them through the company’s offerings.The Technology Leadership Market in Prague showed how many changes the transformation of the DT infrastructure will bring. But these changes will also bring opportunities for partners and customers. A possible Technology Leadership Market 2015 would show the industry how and if this picture will change.Multimedia Investments LtdDocument NKITDE0020141112eabb0001r"
"67",2009-08-26,"IT-Lösungen von der Austria Presse Agentur","IT-Lösungen von der Austria Presse AgenturOliver Weiss 1261 words26 August 2009ComputerweltCMPWLT17 / 2009German© 2009 Info Technologie Verlag GmbH. All rights reserved. For further information see http://www.computerwelt.at[http://www.computerwelt.at]Die APA, führende Nachrichtenagentur des Landes, hat sich mit APA-IT über Österreich hinaus einen Namen gemacht.Die Gebote der Zuverlässigkeit und Schnelligkeit gelten für eine Nachrichtenagentur wie die APA, die zugleich der führende Informationsdienstleister in Österreich ist, in besonderem Maße. Dies bedingt gerade in Sachen IT eine reibungslos funktionierende Basis. Um die Nähe zum Kunden zu optimieren, wurde der Geschäftsbereich als APA-IT ausgegliedert. Als Tochter einer Nachrichtenagentur hat APA-IT jahrzehntelange Erfahrung mit medienspezifischen und mediennahen IT-Umgebungen. Tagtäglich bewältigt das Unternehmen intern wie extern große Datenvolumina, gewährleistet hohen, multimedialen Datendurchsatz und stellt überdurchschnittlich hohe Ansprüche an die IT-Verfügbarkeit. Dieses Know-how kommt auch den Kunden zugute und qualifiziert die APA-IT als Partner im Umgang mit zeitkritischen IT-Systemen.APA-IT ist heute einer der wichtigsten Experte für Redaktionssysteme, Netzwerktechnologie und technische Datenbank-Lösungen. Die Angebotspalette des Unternehmens geht jedoch weit über den Medienbereich hinaus und umfasst ebenso Dienstleistungen im Bereich Serverhosting, Web-Entwicklung, Content Management Systeme (CMS) bis hin zu Broadcasting-Systemen. Die APA-IT übernimmt dabei mit knapp 60 Mitarbeitern Konzeption, Entwicklung und technischen Betrieb der IT-Gesamtlösungen und steht den Kunden von der Entwicklungsphase bis zum produktiven Betrieb als Partner zur Verfügung. Die einzelnen Bereiche der APA-IT kooperieren dabei je nach Projektanforderung und bilden abteilungsinterne oder -übergreifende Projektteams.APPLICATION ENGINEERINGSpezielle Anforderungen können nicht immer mit Standard-Softwarelösungen realisiert werden – das gilt besonders für das Informationsgeschäft. Aus diesem Grund hat die APA-IT früh begonnen, selbst Applikationsentwicklung zu betreiben und ihr Wissen intern sowie auch für ihre Kunden einzusetzen. Jahrzehntelang gesammeltes Expertenwissen dient als Basis dafür, die unterschiedlichsten Kundenanforderungen zu erfüllen können. Die APA-IT bietet von der klassischen Website bis zum Kundenportal mit CMS, von der Newsletter-Lösung bis zum Collaboration-System individuelle Applikations-Lösungen.Professionelle Web- und Java-Entwicklung beginnt mit persönlicher Beratung. Auf individuelle Anfragen hin erhalten Kunden alles aus einer Hand und ersparen sich den aufreibenden Koordinationsaufwand zwischen Provider, Applikationsentwicklung und Design-Agentur. Spezialisten setzen selbst komplexeste Kundenwünsche professionell um. Auf Wunsch übernimmt die APA-IT auch den Betrieb der entwickelten Applikation im leistungsfähigen und ausfallsicheren, hausinternen Rechenzentrum mit 7x24-Stunden-Kundendienst.BROADCASTING SOLUTIONSTV und Radio sind 24 Stunden am Tag auf Sendung – immer aktuell, oftmals live. Dies verlangt von den Redaktionen im Hintergrund besonders rasche Produktion und exakte Abwicklung der Beiträge. Die bedeutendsten Rundfunkanstalten des Landes verlassen sich dabei auf Broadcasting-Systeme der APA-IT. Vor dem eigentlichen Leistungsprozess einer Fernsehanstalt, nämlich der Ausstrahlung von Fernsehsendungen, sind eine Vielzahl komplexer Produktionsschritte notwendig: Redaktionelle Planung, die Durchlaufzeit von Teilprozessen, Rechtemanagement, eine abteilungsübergreifende Kommunikation und der optimierte Einsatz von technischen und personellen Ressourcen sind für die Herstellung von Sendebeiträgen erforderlich. APA-IT Broadcasting Solutions bieten innovative Lösungen zur Unterstützung dieser Prozesse.Auf der Suche nach einer bestimmten Information steht dem User eine oft unüberschaubare Palette an Quellen zur Verfügung. Public-Suchmaschinen verlieren sich im Überangebot des Wissens. Nur hochverfügbare Datenbanken mit intuitiv verständlicher Darstellung der Suchergebnisse ermöglichen zielgenaues und schnelles Zurechtfinden in großen Mengen von Text- und Multimedia-Dokumenten.MEDIA ARCHIVESDie APA-IT bietet ihren Kunden und Partnern im Bereich Medienarchiv eine leistungsfähige Datenbank-Architektur, die Metainformationen eingepflegter Dokumente aus unterschiedlichen Quellen erschließt. Effiziente Beschlagwortung und intelligente Suchfunktionen führen den Benutzer über Millionen von Dokumenten in Sekundenschnelle zur gesuchten Information.OUTSOURCING PC & SERVEREine funktionierende IT-Infrastruktur ist das Rückgrat jedes Unternehmens. Computer, Notebooks, mobile Unternehmens-Kommunikation, auch Peripheriegeräte wie Faxe und Drucker arbeiten nur dann reibungslos, wenn sie permanent gewartet und auf den neuesten Stand gebracht werden. Große Mengen sensibler Unternehmensdaten auf Servern müssen trotz des wachsenden Datenverkehrs ständig erreichbar sein und selbstverständlich vor unerwünschten Angriffen von außen schützen. Aspekte wie die High-Speed-Anbindung an das Internet und optimal konfigurierte Netzwerktechnologie sind dabei ebenso ausschlaggebend wie die ausfallsichere Konfiguration der Systeme. Um den hohen Anforderungen auch in Spitzenzeiten der Auslastung gewachsen zu sein, gilt es, die Systeme rund um die Uhr zu überwachen, zu warten und zu pflegen. Auch diesen Herausforderungen ist die APA-IT gewachsen.Neben diesen vier Kernbereichen arbeitet die APA-IT auch permanent an neuen Ideen. Denn Technologie ist ständig in Bewegung: Ideen werden zu Entwicklungen - Entwicklungen verbinden sich zu Lösungen – innovative Lösungen setzen sich durch und begeistern. APA-IT-PowerSearch, die Datenbank hinter dem APA-OnlineManager (AOM), wurde beispielsweise in der Abteilung APA-IT Innovation entwickelt und für die AOM Version 6.0 Vision mit zukunftsweisenden Funktionen wie semantischen Suchmöglichkeiten und Informationsvisualisierung ausgestattet. Ein weiteres Innovationsfeld ist die automatische Spracherkennung, die es ermöglicht, gesprochene Wörter, beispielsweise aus Radio- oder Fernsehbeiträgen, automatisch in geschriebenen Text umzuwandeln.SEMANTIC QUERIESBegriffe, nach denen in einer Datenbank gesucht wird, haben immer einen bestimmten Kontext – also andere Begriffe, mit denen sie thematisch zusammenhängen. Oft interessiert den Suchenden ein ganzer Themenkomplex und nicht nur ein einzelnes Suchwort. Ein User möchte beispielsweise Dokumente finden, die mit »Innovation« zu tun haben. Im Umfeld des Begriffs »Innovation« finden sich beispielsweise häufig die Begriffe »Entwicklung« und »Forschung«. Die neue Power-Search-Funktion »Semantic Queries« liefert als Ergebnis zum Suchbegriff »Innovation« nicht nur Dokumente, die das Wort »Innovation« enthalten, sondern auch Treffer, in denen »Entwicklung« und »Forschung« vorkommen.Für diese Funktion werden die APA-Datenbanken als Wissensraum genutzt – tagesaktuell, durch die tägliche Neuzuordnung der thematisch verbundenen Begriffe. Die Vorteile für den User sind ein Verbessertes Ranking der Trefferliste, höhere Relevanz der Treffer, relevante Treffer, die den originalen Suchbegriff nicht enthalten sowie ein immer topaktuelles Wissensmodell, da keine manuelle Pflege erforderlich ist.SPRACHERKENNUNGDer Begriff »Automatische Spracherkennung« bezeichnet Technologien, die automatische Umwandlung von gesprochenem Wort in geschriebenen Text ermöglichen. Die so genannte LVCSR (Large Vocabulary Continuous Speech Recognition) ist die größte Herausforderung im Bereich der automatischen Spracherkennung. Dabei müssen alle Wörter erkannt werden, auch wenn mehrere Sprecher vorhanden sind. Ein Beispiel dafür sind Radio- und Fernsehbeiträge, in denen kontinuierlich in unterschiedlichen Umgebungen gesprochen wird. (Clean Speech von Moderatoren, Interview auf der Strasse, im Parlament, mit Musik im Hintergrund etc.)Diese Technologien basieren auf statistischen Modellen, die eine bestimmte Sprache so gut wie möglich modellieren sollen. Mithilfe des umfangreichen APA-Datenbestandes aus tagesaktuellen Audiofiles und Texten kann die APA-IT sowohl für deutsches als auch für österreichisches Deutsch optimale Modelle erstellen. Wichtig ist hier zu bemerken, dass die Sprache lebt und wächst: Jeden Tag entstehen neue Wörter, wie beispielsweise neue Personennamen – deshalb müssen auch die statistischen Sprachmodelle permanent aktualisiert werden. Der Sprachschatz des APA-Datenbestandes ist immer tagesaktuell und bildet damit die optimale Basis zur kontinuierlichen Aktualisierung der statistischen Sprachmodelle. Das Resultat: höchste Leistungen in der Spracherkennung.Die APA-IT Spracherkennungs-Applikationen stellen folgende Funktionen zur Verfügung:- Large Vocabulary Continuous Speech Recognition: Mit einem tagesaktuellen Wörterbuch von mehr als 100.000 Wörtern ist es möglich, Tonspuren von verschiedensten TV- und Radioquellen in Echtzeit kontinuierlich zu erkennen und zu verarbeiten. Der transkribierte Text kann in unterschiedlichen Formaten dargestellt werden, unter anderem auch in XML, wobei jedes Wort mit einem Zeitstempel versehen wird.- Automatische Trennung zwischen gesprochenen und nicht gesprochenen Elementen: Der Audio Stream wird in Sprache, Musik und Stille unterteilt.- Automatische Unterteilung eines Audio Streams in verschiedene Sprecher- Automatische Sprecheridentifikation: Es wird automatisch erkannt, wer gerade spricht.- Topic Detection/Text Kategorisierung/Named Entities Recognition: Der Text-Output der Spracherkennung wird mit unterschiedlichen semantischen Technologien kombiniert und kann in weiterer Folge besonders einfach durchsucht werden.Alle diese Funktionen können untereinander kombiniert werden. Mit bis zu 99 Prozent Erkennungsgenauigkeit, also Richtigkeit der transkribierten Wörter, kann sich die APA-IT Spracherkennung mit anderen state-of-the-art-Systemen messen. Die Transkription erfolgt in Echtzeit – der geschriebene Text erscheint bereits zwei Sekunden, nachdem er gesprochen wurde.Info Technologie Verlag GmbHDocument CMPWLT0020090827e58q0002g"
