"","Datum","Titel","Artikel"
"1",2014-12-20,"Eyes speak louder than words Sensomotoric Instruments develops eye-tracking technology","Eyes speak louder than words Sensomotoric Instruments develops eye-tracking technology381 words12 August 2014Märkische AllgemeineMARKALTabloideGermanCopyright 2014 Märkische Allgemeine – Brandenburgs beste Seiten. All rights reserved. For further information see   http://www.MaerkischeAllgemeine.de[http://www.MaerkischeAllgemeine.de]By Angelika PentsiArnd Rose from Potsdam puts on a pair of black plastic glasses, plugs a cable into his smartphone, and starts looking around the room. A table catches his attention and his gaze lingers there for a moment. A small dot on his smartphone screen follows every movement his eyes make. Rose (36) is demonstrating his company's eye-tracking technology. Sensomotoric Instruments (SMI) in Teltow (district of Potsdam-Mittelmark) has spent more than 20 years working on ways of recording eye movements and lines of sight.Eberhard Schmidt, SMI's managing director, explains that the company grew out of a university research project on maintaining balance during space flight. It has since become the world's second largest supplier of eye-tracking systems. Schmidt says SMI's clients include technology heavyweights like Sony and Google, and the Babylab at the University of Potsdam. The systems are used in everything from market research to neurological studies.The basic assumption behind the technology is that eyes speak louder than words. Eyes will tell you how children learn to perceive their environment, how hand-eye coordination works for surgeons, and which cereal box design is most attractive to customers. Schmidt, an electrical engineer who joined SMI in 1997, says the eye-tracking system is based on a very simple idea: ""The camera takes a picture of your face, or rather your eyes, and then calculates a series of parameters. These allow the system to work out how your eyes are moving and where you're looking at any given moment."" Over the past two decades, and thanks in part to EU funding, SMI has been able to get the technology to a highly sophisticated stage of development.Rose says that in the early days users would have to push the computer equipment around with them in a supermarket trolley. Now all they need are the glasses and a smartphone.Schmidt predicts that eye-tracking systems will develop in much the same way as speech-recognition software. He says our eyes will soon become part of many everyday interactive applications. When that happens, you'll be able to answer your phone just by looking at it.3821794Maerkische Verlags-und Druck-Gesellschaft mbH PotsdamDocument MARKAL0020140812ea8c000hf"
"2",2005-03-20,"Weniger Pflegeaufwand und mehr Effizienz für den Benutzer  ","Weniger Pflegeaufwand und mehr Effizienz für den Benutzer  Alex Wolschann  468 words3 May 2005ComputerweltCMPWLT19 / 2005German© 2005 Info Technologie Verlag GmbH. All rights reserved. For further information see  http://www.computerwelt.at[http://www.computerwelt.at]Version 2.0 der HiPath OpenScape Software-Suite aus dem Hause Siemens wartet mit einem Software Development Kit und natürlicher Spracherkennung auf. Dadurch sollen Kommunikation und Applikationsentwicklung effizienter ablaufen können.  Wien – HiPath OpenScape ist die Software-Suite des Siemens-Bereichs Information and Communication Networks (ICN) für Presence Management, Conferencing und Kollaboration. Die Anwendung zur Echtzeitkommunikation soll für effizientere Teamarbeit und optimierte Arbeitsabläufe sorgen. Interaktionsintensive Geschäftsprozesse könnten Siemens zufolge mit HiPath OpenScape besser organisiert werden.  Version 2.0 der HiPath OpenScape-Applikationssuite, die auf der Cebit 2004 erstmals vorgestellt wurde, ist jetzt am Markt verfügbar und bietet als neue Funktionen zum Beispiel ein automatisches Update des Verfügbarkeits- und Erreichbarkeitsstatus und ein »Software Development Kit« für eine einfachere Integration in Geschäftsprozesse und Applikationen. Mit einem neuen automatischen Update des Verfügbarkeits- und Erreichbarkeitsstatus wird der Pflegeaufwand für den einzelnen Benutzer reduziert. Dabei werden Einträge aus dem Microsoft-Outlook-Kalender automatisch übernommen und als Information über die Verfügbarkeit des Teilnehmers angezeigt, zum Beispiel ""im Meeting"", ""auf Dienstreise"" oder Ähnliches. Diese Informationen werden über den neuen Presence Indicator an den Anrufer übermittelt und zeigen dessen Erreichbarkeitsstatus an. Gleichzeitig wird er informiert, über welches Endgerät die gewünschte Person im Moment kontaktiert werden kann.  INTEGRATION VON GESCHÄFTSPROZESSEN  HiPath OpenScape basiert auf der Web-Services-Architecture und offenen Standards wie Session Internet Protocol (SIP), SIMPLE (SIP for Instant Messaging and Presence Leveraging Extensions), SALT (Speech Application Language Tags), SOAP (Simple Object Access Protocol). Damit können präsenzorientierte Features leicht in gängige IT-gestützte Geschäftsprozesse eingebunden werden, beispielsweise in CRm-Datenbanken (Customer Relationship Management) oder in Back-Office-Plattformen.  Um die Entwicklung individueller Lösungen rund um HiPath OpenScape zu erleichtern und andere Anwendungen besser anbinden zu können, ist für Partner und Kunden ein.  Software Development Kit (SDK) verfügbar. Bestandteil dieses SDK ist unter anderem ein Web Services Toolkit mit ausführlich dokumentierten Schnittstellen, so genannten API (Applikation Programm Interfaces) für Entwickler und Integratoren. Es stellt eine SIP- und SOAP/XML-basierende, offene Applikationsumgebung zur Verfügung, die unabhängig von bestehenden Plattformen zur Sprachkommunikation betrieben werden kann.  Ein weiteres neues Features der Version 2.0 ist zum Beispiel die Funktion »Tell Me When«: Wenn ein dringend gewünschter Gesprächspartner im Moment nicht verfügbar ist, kann der Anrufer veranlassen, dass er eine sofortige Benachrichtigung erhält, sobald dieser wieder erreichbar ist. Weitere Leistungsmerkmale sind eine verbesserte Skalierbarkeit gegenüber Version 1.0 und natürliche Spracherkennung (Natural Speech Recognition) für sprachunterstützte Funktionen. Die Rules Engine wird um einen Assistenten zur Regeldefinition erweitert, über den auf Wunsch und bei entsprechender Voreinstellung die Änderungen des Verfügbarkeitsstatus und des bevorzugten Kommunikationsmittels automatisiert werden kann. Es wird dann zum Beispiel auf Grund der Einstellung ""im Urlaub"" in der OpenScape-Umgebung der Abwesenheits- Assistent für E-Mails (Microsoft Outlook) auf ""Bin zur Zeit nicht im Haus"" gesetzt.  Info Technologie Verlag GmbHDocument CMPWLT0020050505e1530001g"
"3",2004-02-13,"Voice XML 2.0 hat Standardreife.  ","Voice XML 2.0 hat Standardreife.  197 words13 February 2004ComputerwocheCPWCHEGerman(c) Computerwoche 2004  MÜNCHEN (IDG) - Das Web-Konsortium W3C hat die Version 2.0 der Spezifikationen für Voice XML als ""Proposed Recommendation"" veröffentlicht. Damit steht das Papier kurz vor der Standardisierung.  Voice XML soll es ermöglichen, auf Internet-Funktionen mittels Sprachbefehlen oder so genannten Touch-Tones (Töne, die zum Beispiel auf Telefontastaturen hinterlegt sind) zuzugreifen. Im Rahmen des vom W3C entwickelten ""Speech Interface Framework"" bildet Voice XML das Kernstück, das durch die Speech Synthesis Markup Language (SSML) ergänzt wird, die die Sprachausgabe des Rechners steuert, sowie durch die Speech Recognition Grammar Specification (SRGS), die Sprachbefehle definiert.  Die ""Candidate Recommendation"" hatte das W3C bereits vor einem Jahr herausgebracht. Bereits damals rechneten Experten damit, dass sich die Standardisierung in die Länge ziehen werde. Der Grund liegt in lizenzrechtlichen Ansprüchen, denn Voice XML basiert zum Teil auf Technologien, die sich Philips Electronics und die Rutgers University in New Jersey patentieren ließen. Das W3C wollte jedoch nur Standards verabschieden, die lizenzfrei zu nutzen sind. Eine neue Patentrichtlinie, nach der in Einzelfällen Ausnahmen zugelassen werden können, verabschiedete das Konsortium im Mai 2003. Die daraufhin eingesetzte Patent Advisory Group (PAG) konnte die lizenzrechtlichen Fragen mit den Patentinhabern klären. (lex/ue).  IDG Business Verlag GmbHDocument CPWCHE0020040216e02d0000a"
"4",2017-04-20,"newsbox: CREALOGIX erwirbt Machine Learning Technologie für Daten- und","newsbox: CREALOGIX erwirbt Machine Learning Technologie für Daten- und697 words4 September 201713:45AWP Original Press ReleasesAWOPDEGerman© 2017, awp Finanznachrichten AG. All rights reserved. Medienmitteilung Zürich, 4. September 2017 CREALOGIX erwirbt Machine Learning Technologie für Daten- und VideoanalyticsCREALOGIX übernimmt die führende Artificial Intelligence (AI)-Technologie vonKoemei. Die Lösung des Schweizer Startups und Spin-offs des ForschungsinstitutsIDIAP (Partner der Eidgenössischen Technischen Hochschule Lausanne EPFL)ermöglicht dank Machine Learning die automatisierte Umsetzung von Audio- undVideoinhalten in Textdaten für Analytics und die Optimierung. Dadurcherleichtert sie insbesondere die Verwertung multimedialer Inhalte.Datenkategorien, die in Zukunft massiv wachsen und deren Analyse heute beiUnternehmen noch stark vernachlässigt werden, können so effizient genutztwerden. Eine umfangreiche Konzeptsuche sowie Benutzungsanalytics vereinfachendas Handling zusätzlich. Der Digital Banking und Digital Learning Spezialistergänzt mit diesen innovativen AI-Funktionen sein bestehendes digitalesProdukteportfolio.Koemei entwickelte eine skalierbare Plattform im Umgang mit grossen multimediaDatensätzen, zur medienübergreifenden Suche und Analytics von Audio- undVideoinhalten. Ab Herbst 2017 wird die Technologie die Produktepalette desAnbieters für Digital Banking und Digital Learning Services bereichern. Mitdieser Integration können die ständig wachsenden Datenmengen für die Benutzerschnell verwendbar gemacht werden. Urs Widmer, CEO Digital Learning beiCREALOGIX: ""Wir sind begeistert, dass wir die marktführende Plattform vonKoemei erwerben konnten. Kombiniert mit unseren Digital Banking und DigitalLearning Produkten, verhilft diese neue Technologie unseren Kunden zu Mehrwertund Wettbewerbsvorteilen."" Machine Learning Software für optimale DatenanalyseDie Lösung von Koemei erreicht eine der weltweit besten Erkennungsqualitätenbei der Inhaltsanalyse von Audibles, Podcasts und Videos. Die Inhalte werdenhierfür über Automated Speech Recognition (ASR), also der automatisiertenSpracherkennung, in Texte umgewandelt. Anschliessend werden mit ArtificialIntelligence (AI) Tools und Natural Language Processing (NLP) die Texteanalysiert und die Inhalte gemäss vordefinierten Taxonomien und Themenautomatisch klassifiziert, wobei die Datensicherheit zu jeder Zeitgewährleistet ist. In den Videos werden spezifische Schlüsselbegriffeautomatisch erkannt und mit Tags versehen. Nutzer können dank diesen die fürsie relevanten Aussagen in jedem Video finden und direkt dort hinspringen. Diessteigert den Wert von Video- und Audio-Content enorm und spart Zeit bei derRecherche. Die Universität Genf hat bereits über 5'000 Stunden Vorlesungen mitder Technologie in benutzerfreundlicher Weise aufbereitet und diese nahtlos mitder Suche von Textdokumenten integriert. CREALOGIX passt die intelligentenFunktionen mit Konzeptsuche, Inhaltsanalytics und Statistiken den spezifischenAnforderungen seiner Kunden an.Über CREALOGIXDie CREALOGIX Gruppe (http://crealogix.com/[http://crealogix.com/]) ist ein unabhängiges SchweizerSoftwarehaus und gehört als Fintech Top 100 Unternehmen zu den Marktführern imDigital Banking. CREALOGIX entwickelt und implementiert innovativeFintech-Lösungen für die digitale Bank von morgen. Mit den Lösungen vonCREALOGIX antworten Banken auf die sich ändernden Kundenbedürfnisse im Bereichder Digitalisierung, um sich dadurch in einem extrem anspruchsvollen unddynamischen Markt zu behaupten und ihren Mitbewerbern stets einen Schritt vorauszu sein. Die 1996 gegründete Gruppe beschäftigt weltweit über 400Mitarbeitende. Die Aktien der CREALOGIX Gruppe (CLXN) werden an der SIX SwissExchange gehandelt. Die vorliegende Mitteilung enthält zukunftsgerichtete Aussagen, die mitgewissen Risiken, Unsicherheiten und Veränderungen behaftet sein können, dienicht voraussehbar sind und sich der Kontrolle der CREALOGIX Gruppe entziehen.CREALOGIX kann daher keine Zusicherungen machen bezüglich der Richtigkeitsolcher zukunftsgerichteter Aussagen, deren Auswirkung auf die finanziellenVerhältnisse der CREALOGIX Gruppe oder den Markt, in dem Aktien und anderenWertschriften der CREALOGIX Gruppe gehandelt werden.  Medienkontakt CREALOGIX AGJasmin Epp, Corporate Communications Officer Gerne vereinbare ich einen Interviewtermin mit der Geschäftsführung vonCREALOGIX für Sie. Bitte rufen Sie mich unter der Nummer +41 58 404 86 52 anoder senden Sie mir eine E-Mail: mailto:jasmin.epp@crealogix.com * Medienmitteilung (PDF): http://e1.marco.ch/publish/crealogix/55_2217/20170904-CREALOGIX_erwirbt_Machine_Learning_Software_zur_Daten-_und_Videoanalyse.pdf[http://e1.marco.ch/publish/crealogix/55_2217/20170904-CREALOGIX_erwirbt_Machine_Learning_Software_zur_Daten-_und_Videoanalyse.pdf] ________________________________________________________________________________This message has been created and distributed using the Software Suite marCo(R) - Market Communication Office(R). marCo(R) is essential to handle business critical information. Contact the developers of marCo(R) - Market Communication Office(R):A. Tensid EQS AG, Schochenmühlestrasse 4, 6340 Baar, SwitzerlandT. +41 41 763 00 50 (around-the-clock)E. marco@tensid.chVisit http://www.tensid.ch[http://www.tensid.ch] and get your marCo(R) today.--------------------------------------------------------------------------------By using this message (read, copy, etc.) you are bound to the disclaimer:https://www.tensid.ch/home-en/abouttensid/disclaimer/[https://www.tensid.ch/home-en/abouttensid/disclaimer/]--------------------------------------------------------------------------------Videoanalyticsawp Finanznachrichten AGDocument AWOPDE0020170904ed94000m9"
"5",2006-01-30,"Vier von fünf Anfragen im Call Center betreffen Standardvorgänge – Spracherkenner verstehen mittlerweile auch Dialekt und Slang gut genug - Sprachportal rechnet sich im Service zügig   ","Vier von fünf Anfragen im Call Center betreffen Standardvorgänge – Spracherkenner verstehen mittlerweile auch Dialekt und Slang gut genug - Sprachportal rechnet sich im Service zügig   1370 words30 January 2006Computer ZeitungCZTUNG016German(c) 2006 Konradin Verlag.All Rights Reserved. For further information see   http://www.computer-zeitung.de[http://www.computer-zeitung.de]Rund eine Million Mark sollte das Kundenkontaktcenter für die Sparda-Bank Hamburg 2001 kosten. Da stellte man sich bei der Bank die Frage, ob man für Standardanwendungen wie Auszahlungen einen Menschen braucht. Am Automat in der Vorhalle geht es schließlich auch anders.   Die Recherche des eigenen Kontostands und ähnliche Routinevorgänge machen immerhin 80 Prozent aller Kundenanrufe aus. Daraufhin begaben sich Jürgen Mehring, Experte für Inhouse Consulting und Organisation der Sparda Hamburg, und seine Kollegen auf die Suche nach einer sprechenden Maschine. Eine klassische Interactive-Voice Response-Lösung, wie Kunden sie bis heute meist bei computergesteuerten Hotlines finden, sollte es aber nicht sein. Vielmehr suchte man nach einer Lösung für ein Sprachportal, ein Natural Language Understanding System (NLU). „Wir hatten den Anspruch, das Beste zu finden“, betont Mehring im Rückblick.   Fast ein Jahr lang erkundeten die Banker den Markt und entschieden sich schließlich sich gegen alle Varianten mit vorher aufgezeichneten Stimmen und für das Text-to-Speech-System der schottischen Firma Rhetorical. „Wir mussten bis Schottland gehen für die beste deutsche Stimme“, so Mehring.   Rhetorical, im Jahr 2000 in Edinburgh gegründet, hatte gerade die weltweit erste Text-to-Speech-Konferenz veranstaltet. Inzwischen, so Mehring, wurde Rhetorical von der heutigen Nuance übernommen, von der die Sparda-Bank auch das Modul zur Spracherkennung eingekauft hat. Die Verknüpfung von Dialogen und notwendigen Daten in den verschiedenen Datenbanken, die Core Machine, realisiert Semantic Edge aus Berlin.   Das 2003 nach Tests in verschiedenen Einzelfilialen nach und nach für alle Zweigstellen der Sparda-Bank in Hamburg in Betrieb genommene System wurde 2004 bei den Voicedays gleich als beste Branchenlösung ausgezeichnet. Bis heute, so betont Mehring, müsse man suchen, um vergleichbar gute Lösungen zu finden.   Breite Anwendungen sind nun im Portal   Das NLU der Sparda-Bank Hamburg zeichne sich, so versichern Mehring und sein Kollege Rüdiger Möller, Leiter des Qualitätsmanagements, dadurch aus, dass Kunden frei von der Leber weg ihre Wünsche kundtun können. Zwar könnten Slang, Dialekt oder auch extreme Jugendsprache die Maschine verwirren. Wenn etwa selbst ein menschlicher Mitarbeiter Schwierigkeiten hätte, jemanden wegen starken Dialekts oder Akzents zu verstehen, dann versage auch die Maschine, so Mehring: „Doch wenn in dem, was der Anrufer sagt, das Wort Kontostand zu erkennen ist, bekommen Sie, was Sie wollen.“   Kunden können über das NLU derzeit neben der Konto- und Umsatzabfrage Überweisungen und Umbuchungen vornehmen, Bestellungen für Schecks oder ähnliches aufgeben, allgemeine Informationen erfragen oder sich weitervermitteln lassen zur Filiale oder dem Telefonberatungsteam. Jederzeit, so Mehring, kann der Anrufer der Maschine klar machen, dass er jetzt lieber einen Mitarbeiter sprechen will.   Nicht jeder spricht mit einer Maschine   Trotzdem hat man mit Blick auf die weniger technikaffinen Kunden das System einmal komplett neu eingestellt. Ursprünglich hatten die Sparda-Banker in ihrer Begeisterung alle Anrufe über das NLU-System geleitet und die Kunden einfach von dort aus zu den traditionellen Kanälen weitergeleitet. „Manche haben es einfach rundweg abgelehnt, mit einer Maschine zu sprechen,“ so Möller. „Da die Kundenzufriedenheit für uns sehr wichtig ist, haben wir reagiert.“   Inzwischen arbeitet die Bank wieder mit zwei separaten Service-Nummern, einer für das Call Center mit Menschen und der anderen für das Sprachportal mit „fast menschlicher Dialogführung“, wie es in einer Präsentation der Bank formuliert ist. Auch den Avatar Michaela May gibt es nicht mehr: „Diese Gleichsetzung der Maschine mit dem Menschen war vielen Kunden fremd“, berichtet Mehring.   Die neuen Zufriedenheitswerte seien gut, sagt Möller, das zeigte eine eigens extern in Auftrag gegebene Befragung von Kunden. In den Mailings und Briefen der Bank, im Kundenmagazin und sogar auf den Kontoauszügen wird das System weiterhin intensiv beworben, denn nach wie vor entfallen gerade bei den Anrufen in Filialen rund 50 Prozent auf Tätigkeiten, die übers NLU gut abgewickelt werden könnten.   Diese Gespräche kosten das Unternehmen 30 Cent pro Anruf. Zum Vergleich: Die Konversation mit dem Telefonberatungsteam kommt auf durchschnittlich vier Euro. Bei rund 80 000 Anrufen lässt sich die Kosteneinsparung ausrechnen. Bei den Gesamtkosten sei man unter den geplanten 500 000 Euro geblieben.   Natürlich, so Möller, werde das Gespräch mit dem Mitarbeiter immer erhalten bleiben. Das Sprachportal sei Bestandteil eines Gesamtsystems. Speziell das als eigene Abteilung arbeitende Telefonberatungsteam, das bevorzugt Neukunden betreut oder zu persönlichen Krediten, Baufinanzierungen, Fonds- oder Depotanlagen Auskunft gibt, ist nicht wegzudenken. Rund ein Viertel der Anrufe landet hier.   Umpolen würde die Sparda-Bank dagegen gerne noch mehr Direktanrufe, die bislang in der Filiale herauskommen. „Übrigens gibt es durchaus auch ältere Kunden, die das inzwischen gerne annehmen“, so Möller. Die Technikmuffel macht Mehring eher bei den um die 50-Jährigen aus. Möglich auch, dass nicht zuletzt ältere Kunden den Spareffekt beim Telefon-Banking schätzen. Um das Sprachportal zusätzlich schmackhaft zu machen, kostet der Anruf dort weniger als im Beratungscenter. Zusätzlich gibt es Bonuspunkte. Klappern, so Mehring, gehöre zum Ge- schäft. Monika Ermert/pg   „Verifikation der Kunden ist geplant“   Wie sicher ist es denn, wenn man seine Überweisungen dem Sparda-Sprachportal anvertraut? Und werden die Anrufe aufgezeichnet?   Für die Fälle, in denen Geld bewegt wird, zeichnen wir Gespräche in der Tat auf. Darüber werden die Kunden allerdings vorab informiert. Sie stimmen dem in der Vereinbarung für die Teilnahme am Sprachportalsystem explizit zu. Wenn Sie aber lediglich ihren Kontostand abrufen, wird von uns natürlich nichts aufgezeichnet.   Können Ihre Kunden die Sprachaufzeichnung vermeiden?   Sie können aus Datenschutzgründen in solchen Fällen ihre Befehle auch per Tastatur eingeben.   Bei Börsengeschäften würde dann auch alles aufgezeichnet?   Ja. Börsengeschäfte werden allerdings im Moment noch nicht über das Sprachportal erledigt. Für die Zukunft ist das aber denkbar, dass man über das Sprachportal auch ordern kann. Prinzipiell ist es möglich, das einzubinden. Wir haben sehr darauf geachtet, dass das System offen ist für weitere Dienste. Die Basis dafür sind die Standards HTML und XML. Was uns auch brennend interessiert, ist die Verifikation der Kunden über Sprache. Sie brauchen sich dann keine lästigen Geheimzahlen mehr zu merken, der Computer begrüßt sie vielmehr nach einigen Worten gleich persönlich.   Macht Ihr Beispiel eigentlich Schule bei anderen Banken und hatten Sie auch selbst Vorbilder?   Vorbilder hatten wir. Wir haben uns zum Beispiel das Sprachportal der Schweizer UBS sehr genau angesehen und uns nur deshalb für einen eigenen Weg entschieden, weil wir nicht den gleichen Aufwand in Bezug auf die Mehrsprachigkeit für notwendig gehalten haben. Die UBS muss alle Sprachen der Schweiz abdecken. Auch Nachahmer gibt es, aber wir halten unser System immer noch für eines der besten im deutschen Raum. Monika Ermert/pg   Voice-Lösung streicht Auszeichnung ein   Die Sparda-Bank Hamburg gehört mit rund 1,8 Millarden Euro Kundeneinlagen und 180 000 Kunden zu den großen Genossenschaftsbanken in Deutschland. Sie ist eines der technologisch innovativen Institute der Finanzbranche. So hat sie die erste reine Internetbank, die Netbank AG, gegründet. 2003 wurde das Sprachportal gestartet, über das Bankgeschäfte im Dialog mit einer Computerstimme abwickeln können. 2004 erhielt das Projekt den Voice Award. Zwar sind manche Kunden noch ängstlich, bei der Sparda ist man aber vom Konzept überzeugt. Monika Ermert/pg   Der ungeliebte Avatar verschwindet wieder   In der Anfangszeit wollte die Sparda-Bank mit dem Avatar Michaela May auf ihre Kunden zugehen. Doch das virtuelle Menschenimitat kam nicht gut an und ist mittlerweile in der Schublade verschwunden.   Technisch verbirgt sich hinter dem Sprachportal eine von Semantic Edge realisierte Plattform, die eine Automatic-Speech-Recognition-Software (ASR) des Herstellers Nuance zur Erkennung gesprochener Sprache beinhaltet. Für die andere Richtung, die Umsetzung von Text in Sprache, ist ebenfalls eine Lösung von Nuance im Einsatz. Sie bietet Schnittstellen zu verschiedenen Datenbanken und Applikationen.   Ein Siemens Hipath-4000-Router reicht die Gespräche über ein Phoneboard des Herstellers NMS an die dreiteilige Plattform beziehungsweise an die IP-Infrastruktur des Unternehmens weiter. Das Phoneboard ermöglicht es auch, vorhandene analoge Geräte an die Internet-Telefonieinfrastruktur anzuschließen.   Die Betrachtung der kompletten eingesetzen Telefonielösung gehörte für die Sparda-Bank zu dem veränderten Konzept. Die Offenheit für künftige Applikationen wiederum soll durch die XML-, HTML- und Java-Fähigkeit der Plattform gewährleistet werden.   Zwar wurde Michaela May inzwischen wieder von einem sachlich-realistischen Portal abgelöst, doch das System soll weiter ausgebaut und in Zukunft auch in Richtung Spracherkennung zur Authentifizierung getrimmt werden. Entsprechende Lösungen sind derzeit noch in Arbeit.   Monika Ermert/pg   Konradin Verlag Robert Kohlhammer GmbHDocument CZTUNG0020060130e21u0000g"
